claim_id,status,paper_claim,evidence,safe_writing
C1,Supported,Bounded Sketch reduces the current Exact Affinity interface cost.,"N=128,R=256,K=8: snapshot Sketch=77824B vs Exact=2109440B; update Sketch=6553.6B/s vs Exact=209715.2B/s.",Use as the replacement for legacy Rich-size Table 1.
C2,Supported with workload scope,Exact visibility is an information upper bound and bounded K can approach it under locality.,Frozen high locality: Exact reuse=0.9077333333333333; Sketch-K8=0.8424666666666667. Closed-loop high: Exact=0.5571428571428572; Sketch-K16=0.5571428571428572.,State frozen results as controlled interface evidence; label closed-loop observed reuse as dispatcher-observed.
C3,Supported,Validation keeps stale metadata from authorizing unsafe reuse.,Validation-on max unsafe reuse=0.0; seven TOCTOU race maximum unsafe count=0.,"Correctness evidence only, not a latency speedup."
C4,Supported as simulation,Budgeted event-driven dissemination can retain quality under low/mid churn and exposes no-rate overload.,B4 low churn saved=180000.0 vs periodic=90000.0; B4 mid stale=0.0; B3 high-churn p95 delay=1550.0ms.,"Call this a control-plane simulation, not a live metadata transport benchmark."
C5,Negative result / Route B,Current demand-aware utility should not be presented as the default superior admission policy.,"Full utility mean saved/exact: high K8=0.731, medium K16=0.678; high-to-low convergence mean=1500 requests.",Describe demand-aware admission as pluggable. Use LRU/coverage as default bounded admission in this workload generator.
